{
  "schemaVersion": "1.0",
  "engineVersion": "1.0.0",
  "id": "a8055768-eb3d-447f-9fab-3187ad910a81",
  "title": "Stark im Alltag - 4 Wochen",
  "subtitle": "Grundlagenphase · 3 Einheiten pro Woche",
  "status": "active",
  "createdAt": "2026-08-15T11:19:01.190036+00:00",
  "startsOn": "2026-09-07",
  "endsOn": "2026-10-04",
  "durationWeeks": 4,
  "sessionsPerWeek": 3,
  "goalType": "health_strength",
  "discipline": "strength",
  "phase": "foundation",
  "athleteSnapshot": {
    "firstName": "Elisabeth",
    "ageGroup": "70+",
    "goal": "Stark und gesund bleiben",
    "sports": [
      "Krafttraining",
      "Wandern",
      "Mobilität"
    ],
    "experience": "Wiedereinstieg",
    "currentTrainingDays": 3,
    "event": null,
    "equipmentSummary": [
      "Langes Widerstandsband",
      "Körpergewicht",
      "Stabiler Stuhl",
      "Kurzhantel(n)",
      "Freie Bodenfläche",
      "Trainingsmatte",
      "Miniband/Loop-Band",
      "Outdoor-Strecke",
      "Wand"
    ],
    "restrictionSummary": [
      "Schulter (rechts): Belastung vorerst aussparen; angegebene Intensität 3/10.",
      "Bei geringer Knochendichte: ruckartige Sprünge und stark belastete Rumpfbeugung vermeiden.",
      "Gelenkbelastung über schmerzarmen Bewegungsumfang und ruhiges Tempo dosieren."
    ]
  },
  "safety": {
    "status": "ready",
    "generationAllowed": true,
    "notices": [
      "Ruckartige Belastungen und stark belastete Rumpfbeugung werden konservativ behandelt.",
      "Bewegungsumfang und Belastung werden nach Verträglichkeit dosiert."
    ],
    "disclaimer": "Der Plan ist eine automatisierte Trainingshilfe und keine medizinische Diagnose oder Therapie. Neue, zunehmende oder ungeklärte Beschwerden müssen fachlich abgeklärt werden."
  },
  "principles": [
    "Die geplante Intensität wird über RPE und den Sprechtest gesteuert - nicht über ein starres Tempo.",
    "Technisch saubere, gut verträgliche Wiederholungen haben Vorrang vor zusätzlichem Gewicht oder Umfang.",
    "Die vierte Woche jedes Blocks reduziert die Belastung, damit Anpassung und Erholung stattfinden können.",
    "Last erst steigern, wenn der obere Wiederholungsbereich mit stabiler Technik erreicht wird."
  ],
  "planNotes": [
    "Alltagshinweis: Lieber kurze Einheiten; freitags ist Unterstützung durch eine Freundin möglich.",
    "Ruckartige Belastungen und stark belastete Rumpfbeugung werden konservativ behandelt.",
    "Bewegungsumfang und Belastung werden nach Verträglichkeit dosiert."
  ],
  "weeks": [
    {
      "weekNumber": 1,
      "theme": "Ankommen und Technik",
      "coachNote": "Belastung kalibrieren und Bewegungsqualität sichern.",
      "loadFactor": 0.9,
      "targetMinutes": 85,
      "sessions": [
        {
          "type": "strength",
          "discipline": "Krafttraining",
          "title": "Alltagskraft A - sicher und stabil",
          "subtitle": "Woche 1: Technik festigen und eine gut verträgliche Ausgangsbelastung finden.",
          "durationMinutes": 30,
          "intensity": {
            "rpe": "5-8/10",
            "zone": "submaximal",
            "talkTest": "zwischen den Sätzen vollständig erholen"
          },
          "objective": "Technik festigen und eine gut verträgliche Ausgangsbelastung finden.",
          "warmup": [
            {
              "title": "Allgemein erwärmen",
              "details": "5-8 Minuten lockere Bewegung oder zügiges Gehen.",
              "durationMinutes": 6
            },
            {
              "title": "Bewegungen vorbereiten",
              "details": "Die ersten zwei Übungen je 1-2 leichte Vorbereitungssätze ausführen.",
              "durationMinutes": 5
            }
          ],
          "blocks": [
            {
              "type": "strength",
              "title": "Kraft-Hauptteil",
              "instructions": "Übungen nacheinander ausführen. Die angegebenen Pausen vollständig nutzen.",
              "exercises": [
                {
                  "exerciseId": "EX001330",
                  "name": "Kniebeuge mit Körpergewicht",
                  "pattern": "Kniebeuge",
                  "primaryMuscle": "Quadrizeps",
                  "equipment": [
                    "Körpergewicht",
                    "Freie Bodenfläche"
                  ],
                  "sets": 2,
                  "reps": "6-10 kontrolliert",
                  "restSeconds": 90,
                  "tempo": "3-1-2",
                  "targetRpe": "5-7/10",
                  "progression": "Technik und passende Startlast finden.",
                  "notes": [],
                  "alternatives": [
                    {
                      "exerciseId": "EX001324",
                      "name": "Goblet Squat mit Kurzhantel"
                    },
                    {
                      "exerciseId": "EX001322",
                      "name": "Gefangenen-Kniebeuge"
                    }
                  ]
                },
                {
                  "exerciseId": "EX000640",
                  "name": "Bandrudern im Stand",
                  "pattern": "Horizontal ziehen",
                  "primaryMuscle": "Latissimus",
                  "equipment": [
                    "Langes Widerstandsband"
                  ],
                  "sets": 2,
                  "reps": "6-10 kontrolliert",
                  "restSeconds": 90,
                  "tempo": "3-1-2",
                  "targetRpe": "5-7/10",
                  "progression": "Technik und passende Startlast finden.",
                  "notes": [],
                  "alternatives": [
                    {
                      "exerciseId": "EX000642",
                      "name": "Einarmiges Bandrudern"
                    },
                    {
                      "exerciseId": "EX000722",
                      "name": "Kurzhantelrudern beidarmig vorgebeugt"
                    }
                  ]
                },
                {
                  "exerciseId": "EX001123",
                  "name": "Band-Brustpresse im Stand",
                  "pattern": "Horizontal drücken",
                  "primaryMuscle": "Brustmuskulatur",
                  "equipment": [
                    "Langes Widerstandsband"
                  ],
                  "sets": 2,
                  "reps": "8-12 kontrolliert",
                  "restSeconds": 75,
                  "tempo": "3-1-2",
                  "targetRpe": "5-7/10",
                  "progression": "Technik und passende Startlast finden.",
                  "notes": [],
                  "alternatives": [
                    {
                      "exerciseId": "EX001128",
                      "name": "Einarmige Band-Brustpresse"
                    },
                    {
                      "exerciseId": "EX001213",
                      "name": "Liegestütz"
                    }
                  ]
                },
                {
                  "exerciseId": "EX001299",
                  "name": "Split Squat mit Körpergewicht",
                  "pattern": "Ausfallschritt/einbeinig",
                  "primaryMuscle": "Quadrizeps",
                  "equipment": [
                    "Körpergewicht",
                    "Freie Bodenfläche"
                  ],
                  "sets": 2,
                  "reps": "8-12 kontrolliert",
                  "restSeconds": 75,
                  "tempo": "3-1-2",
                  "targetRpe": "5-7/10",
                  "progression": "Technik und passende Startlast finden.",
                  "notes": [
                    "Beide Seiten trainieren; mit der schwächeren oder unsicheren Seite beginnen."
                  ],
                  "alternatives": [
                    {
                      "exerciseId": "EX001068",
                      "name": "Ausfallschritt rückwärts mit Körpergewicht"
                    },
                    {
                      "exerciseId": "EX001076",
                      "name": "Ausfallschritt vorwärts mit Körpergewicht"
                    }
                  ]
                },
                {
                  "exerciseId": null,
                  "name": "Tandemstand mit Haltemöglichkeit",
                  "pattern": "Gleichgewicht",
                  "primaryMuscle": "Ganzkörper/Stabilität",
                  "equipment": [
                    "Stabiler Stuhl oder Wand"
                  ],
                  "sets": 2,
                  "reps": "20-30 Sek. pro Position",
                  "restSeconds": 45,
                  "tempo": "ruhig",
                  "targetRpe": "3-5/10",
                  "progression": "Haltekontakt nur reduzieren, wenn der Stand sicher bleibt.",
                  "notes": [
                    "Immer in Reichweite einer stabilen Haltemöglichkeit trainieren."
                  ],
                  "alternatives": [
                    {
                      "exerciseId": null,
                      "name": "Gewichtsverlagerung im Stand"
                    }
                  ]
                }
              ]
            }
          ],
          "cooldown": [
            {
              "title": "Ruhig ausklingen",
              "details": "2-5 Minuten locker bewegen und Atmung normalisieren.",
              "durationMinutes": 4
            }
          ],
          "equipment": [
            "Freie Bodenfläche",
            "Körpergewicht",
            "Langes Widerstandsband",
            "Stabiler Stuhl oder Wand"
          ],
          "adaptations": [
            "Schulter (rechts): Belastung vorerst aussparen; angegebene Intensität 3/10.",
            "Bei geringer Knochendichte: ruckartige Sprünge und stark belastete Rumpfbeugung vermeiden.",
            "Gelenkbelastung über schmerzarmen Bewegungsumfang und ruhiges Tempo dosieren.",
            "Ruhige Positionswechsel; keine Eile beim Hinsetzen, Aufstehen oder Gerätewechsel."
          ],